{
  "event": "Other",
  "site": "Local",
  "date": "2026.04.23",
  "round": "1",
  "white": "Felipe",
  "black": "Computer",
  "result": "1-0",
  "moves": [
    { "turn": 1, "white": "e4", "black": "e5" },
    { "turn": 2, "white": "Nf3", "black": "Nc6" },
    { "turn": 3, "white": "Bb5", "black": "Nf6" },
    { "turn": 4, "white": "O-O", "black": "d6" },
    { "turn": 5, "white": "d4", "black": "Bd7" },
    { "turn": 6, "white": "d5", "black": "Nb4" },
    { "turn": 7, "white": "Bc4", "black": "a5" },
    { "turn": 8, "white": "a3", "black": "Na6" },
    { "turn": 9, "white": "Bxa6", "black": "Rxa6" },
    { "turn": 10, "white": "Qd3", "black": "c6" },
    { "turn": 11, "white": "Re1", "black": "cxd5" },
    { "turn": 12, "white": "exd5", "black": "e4" },
    { "turn": 13, "white": "Qd4", "black": "Qc8" },
    { "turn": 14, "white": "Bg5", "black": "Bf5" },
    { "turn": 15, "white": "Bxf6", "black": "gxf6" },
    { "turn": 16, "white": "Qxf6", "black": "h5" },
    { "turn": 17, "white": "Qxh8", "black": "Qc4" },
    { "turn": 18, "white": "Nbd2", "black": "Qxd5" },
    { "turn": 19, "white": "Nd4", "black": "Qe5" },
    { "turn": 20, "white": "Rxe4", "black": "Bxe4" },
    { "turn": 21, "white": "Qxe5+", "black": "dxe5" },
    { "turn": 22, "white": "Nxe4", "black": "exd4" },
    { "turn": 23, "white": "Re1", "black": "Re6" },
    { "turn": 24, "white": "Nf6+", "black": "Ke7" },
    { "turn": 25, "white": "Rxe6+", "black": "Kxe6" },
    { "turn": 26, "white": "Nxh5", "black": "Ke5" },
    { "turn": 27, "white": "Kf1", "black": "d3" },
    { "turn": 28, "white": "cxd3", "black": "Kd4" },
    { "turn": 29, "white": "Ke2", "black": "Bd6" },
    { "turn": 30, "white": "Ng3", "black": "Be7" },
    { "turn": 31, "white": "Nf5+", "black": "Ke5" },
    { "turn": 32, "white": "Nxe7", "black": "Kf6" },
    { "turn": 33, "white": "Nd5+", "black": "Ke6" },
    { "turn": 34, "white": "Nc3", "black": "b6" },
    { "turn": 35, "white": "h4", "black": "Kf5" },
    { "turn": 36, "white": "f3", "black": "Kf4" },
    { "turn": 37, "white": "h5", "black": "Kg3" },
    { "turn": 38, "white": "h6", "black": "Kxg2" },
    { "turn": 39, "white": "h7", "black": "f5" },
    { "turn": 40, "white": "h8=Q", "black": "a4" },
    { "turn": 41, "white": "Nd5", "black": "f4" },
    { "turn": 42, "white": "Nxb6", "black": "Kg1" },
    { "turn": 43, "white": "Nxa4", "black": "Kg2" },
    { "turn": 44, "white": "Nc5", "black": "Kg3" },
    { "turn": 45, "white": "Ne4+", "black": "Kg2" },
    { "turn": 46, "white": "Qh4", "black": "Kg1" },
    { "turn": 47, "white": "Qf2+", "black": "Kh1" },
    { "turn": 48, "white": "Qf1+", "black": "Kh2" },
    { "turn": 49, "white": "Qf2+", "black": "Kh1" },
    { "turn": 50, "white": "Qh4+", "black": "Kg2" },
    { "turn": 51, "white": "Qxf4", "black": "Kh1" },
    { "turn": 52, "white": "Nf2+", "black": "Kg2" },
    { "turn": 53, "white": "Qg4+", "black": "Kh2" },
    { "turn": 54, "white": "Qh3+", "black": "Kg1" },
    { "turn": 55, "white": "Qh1#", "black": null }
  ]
}